{
  "format_version": "1",
  "base_model_id": "cross-encoder/mmarco-mMiniLMv2-L12-H384-v1",
  "exported_at": "2026-03-12T15:01:00Z",
  "corrections": [
    {
      "pergunta": "O procedimento exige revisão anual das contas privilegiadas?",
      "trecho": "As contas com privilégios elevados são revistas pelo menos uma vez por ano pelo responsável do sistema.",
      "etiqueta": "positivo",
      "lente": "verificar",
      "hash_par": "f3a91c0e7b2d4e8a1c6f0b9d5e3a7c2d1f8b4e6a0c9d7b5e3f1a8c6d4b2e0f9a"
    },
    {
      "pergunta": "O procedimento exige revisão anual das contas privilegiadas?",
      "trecho": "As palavras-passe devem ter pelo menos doze caracteres e ser únicas por serviço.",
      "etiqueta": "negativo",
      "lente": "verificar",
      "hash_par": "0b1c2d3e4f5061728394a5b6c7d8e9f0a1b2c3d4e5f60718293a4b5c6d7e8f90"
    },
    {
      "pergunta": "Há evidência de formação em phishing no último trimestre?",
      "trecho": "No trimestre anterior realizaram-se duas sessões de sensibilização sobre mensagens fraudulentas.",
      "etiqueta": "positivo",
      "lente": "assessment",
      "hash_par": "9e8d7c6b5a4938271605f4e3d2c1b0a9f8e7d6c5b4a3928170615243f0e1d2c3"
    }
  ]
}
